{
  "id": "example-connector",
  "displayName": "Example Connector",
  "version": "0.1.0",
  "description": "A minimal manifest that satisfies every required field.",
  "author": "Nimbus Contributors",
  "entrypoint": "./index.ts",
  "runtime": "bun",
  "permissions": [
    "read"
  ],
  "hitlRequired": [],
  "minNimbusVersion": "0.1.0",
  "sync": {
    "contract": "1",
    "intervalSeconds": 3600,
    "itemTypes": [
      "Highlight"
    ]
  }
}
